{
  "schemaVersion": "1.0.0",
  "projectId": "new-track-project",
  "title": "New Track Project",
  "selectedProfileId": "final-fast-1080p",
  "generationProfiles": [
    {
      "profileId": "final-fast-1080p",
      "modelId": "veo-3.1-fast-generate-001",
      "resolution": "1080p",
      "aspectRatio": "16:9",
      "fps": 24,
      "durationSeconds": 8,
      "sampleCount": 1,
      "generateAudio": false,
      "enhancePrompt": true,
      "compressionQuality": "optimized",
      "personGeneration": "allow_adult"
    }
  ],
  "maxSpendUsd": 5.0,
  "retryReserveFactor": 1.5,
  "requiredShotIds": ["shot-001", "shot-002"],
  "storagePrefix": "trackprompt-video-generation",
  "localOutputRoot": ".trackprompt-data/video-generation",
  "timeline": {
    "clockSource": "original-audio",
    "analysisBinding": "existing TrackPrompt StoryPlan/ShotPlan when available",
    "fps": 24,
    "width": 1920,
    "height": 1080,
    "targetEditSeconds": 6.0,
    "generatedClipDurationSeconds": 8,
    "autoAssembly": true,
    "davinciExports": ["fcpxml-1.11", "fcp7-xml", "cmx3600-edl", "marker-csv", "edit-sheet-csv"]
  }
}
